2026-07-27,Matthieu 13, 24-30,"Jésus proposa aux foules une autre parabole : 'Le royaume des Cieux est comparable à un homme qui a semé du bon grain dans son champ.'"[citation:3]
2026-07-28,Jérémie 7, 1-11,"Parole du Seigneur adressée à Jérémie."
2026-07-29,Psaume 84 (83), 3-6.8.11,"Mon âme s'épuise à désirer les parvis du Seigneur."
2026-07-30,Matthieu 13, 36-43,"Laissant les foules, Jésus vint à la maison."
2026-07-31,Jérémie 18, 1-6,"Parole du Seigneur adressée à Jérémie : 'Lève-toi, descends chez le potier.'"
2026-06-01,2 Pierre 1, 2-7,"Que la grâce et la paix vous soient accordées en abondance par la vraie connaissance de Dieu et de Jésus notre Seigneur. [...] pour que, par eux, vous deveniez participants de la nature divine."[citation:1]
2026-06-02,Psaume 90 (91), 1-2,"Quand je me tiens sous l'abri du Très-Haut et repose à l'ombre du Puissant, je dis au Seigneur : 'Mon refuge, mon rempart, mon Dieu, dont je suis sûr !'"[citation:1]
2026-06-03,Marc 12, 1-12,"Jésus se mit à parler en paraboles : 'Un homme planta une vigne...'"[citation:1]
2026-06-04,1 Pierre 1, 3-9,"Béni soit Dieu, le Père de notre Seigneur Jésus Christ : dans sa grande miséricorde, il nous a fait renaître pour une vivante espérance."
2026-06-05,Psaume 111 (110), 1-10,"Je rendrai grâce au Seigneur de tout mon cœur."
2026-06-06,Marc 12, 18-27,"Des sadducéens vinrent trouver Jésus. Ces gens disent qu'il n'y a pas de résurrection..."
2026-06-07,2 Timothée 1, 1-12,"Je rends grâce à Dieu [...] quand, nuit et jour, je fais mémoire de toi dans mes prières."
2026-06-08,Psaume 63 (62), 2-9,"Dieu, tu es mon Dieu, je te cherche dès l'aube : mon âme a soif de toi."
2026-06-09,Marc 12, 28-34,"Un scribe s'avança vers Jésus et lui demanda : 'Quel est le premier de tous les commandements ?'"
2026-06-10,1 Rois 17, 1-6,"Élie le Tishbite dit à Achab : 'Par le Seigneur vivant, il n'y aura pas ces années-ci de rosée ni de pluie.'"
2026-06-11,Psaume 121 (120), 1-8,"Je lève les yeux vers les montagnes : d'où le secours me viendra-t-il ? Le secours me vient du Seigneur."
2026-06-12,Deutéronome 7, 6-11,"Tu es un peuple consacré au Seigneur ton Dieu : c'est toi qu'il a choisi."[citation:8]
2026-06-13,Luc 2, 41-51,"Sa mère gardait dans son cœur tous ces événements."[citation:2]
2026-06-14,1 Rois 19, 9a.11-16,"Le Seigneur dit : 'Sors et tiens-toi sur la montagne devant le Seigneur, car il va passer.'"
2026-06-15,Psaume 27 (26), 7-14,"Écoute, Seigneur, je t'appelle ! Pitié ! Réponds-moi !"
2026-06-16,Marc 12, 38-44,"Dans son enseignement, Jésus disait : 'Méfiez-vous des scribes...'"
2026-06-17,2 Corinthiens 8, 1-9,"Vous connaissez la générosité de notre Seigneur Jésus Christ."
2026-06-18,Psaume 146 (145), 2.5-10,"Il est bon de fêter notre Dieu, il est beau de lui chanter des louanges."
2026-06-19,Marc 13, 1-13,"Jésus sortait du Temple quand un de ses disciples lui dit : 'Maître, regarde : quelles pierres, quelles constructions !'"
2026-06-20,2 Corinthiens 11, 1-11,"Je suis jaloux de vous d'une jalousie de Dieu."
2026-06-21,Psaume 34 (33), 2-7,"Je bénirai le Seigneur en tout temps."
2026-06-22,Marc 13, 14-23,"Quand vous verrez l'abomination de la désolation installée là où il ne faut pas, - que le lecteur comprenne ! - alors, ceux qui seront en Judée, qu'ils s'enfuient dans les montagnes."
2026-06-23,2 Corinthiens 11, 18.21b-30,"Puisque beaucoup se vantent à la manière du monde, moi aussi je veux me vanter."
2026-06-24,Luc 1, 57-66.80,"Quand fut accompli le temps où Élisabeth devait enfanter, elle mit au monde un fils."
2026-06-25,2 Chroniques 24, 17-25,"Après la mort de Joad, les princes de Juda vinrent se prosterner devant le roi Joas."[citation:2]
2026-06-26,Actes 12, 1-11,"En ces jours-là, le roi Hérode Agrippa se mit à maltraiter certains membres de l'Église."
2026-06-27,Psaume 34 (33), 2-9,"Je bénirai le Seigneur en tout temps, sa louange sans cesse à mes lèvres."
2026-06-28,Marc 13, 24-32,"En ces jours-là, après une telle détresse, le soleil s'obscurcira et la lune ne donnera plus sa clarté."
2026-06-29,Actes 3, 1-10,"Pierre et Jean montaient au Temple pour la prière de l'après-midi."
2026-06-30,Matthieu 16, 13-19,"Jésus, arrivé dans la région de Césarée-de-Philippe, demandait à ses disciples : 'Au dire des gens, qui est le Fils de l'homme ?'"
